 ," Botö guiquënë , Wengonguï , Ïïmaï ceedäni , ante nänö wee angaïnö ante cöwë ",ëñenguënëmo,True," inte botö mönö Awënë Codito nempo quëwëninque tömengä nänö angaïnö ante cöwë ëñente quëwëmopa "
 ," Ede bitö ënï baï ayë ponte cedingä ingante adopo ",godonguënëmo,True," intabopa "
 ," Ede , Botö nämä në waa cebo ïnömo inte ede yecado ",ongonguënëmo,True," ïmopa , ante në cecä ïñömö tömengä ïñömö weentodonte baï guingo imonte wececäimpa "
 ," Ayë mëönaa go adoöneque ïñonte botö ñäni ömëmonte ",quëwenguënëmo,True," ïmopa , ante apënecä ëñëmïni inte pönenguënë quëwëedäni "
 ," Itota weetë Pegodo ingante , — Bitö yaëmë adodö da wëe , äninque , Botö wewenguïmämo ante botö Mempo pönongä ënïmo inte ",wewenguënëmo,True," ïmopa , angacäimpa "
 ," Botö , Codito engä beyenque mönö quëwëmämo ebänö ï , ante quingë yewëmoncete ante ceyömote wadäni wëne wëne cedäni ate wedinque botö , Mïnitö wee ceedäni , ante ",yewëmonguënëmo,True," batabopa "
