,Nadao sam se da ću nakon rata,dobiti,True,"natrag svoj posao , ali to se nije dogodilo . """
,""" Ako želite",dobiti,True,"nešto [ kao manjina ] , morate to tražiti ."
,Tri filma iz jugoistočne Europe uvrštena su na popis 12 filmova koji će,dobiti,True,financijsku potporu iz fonda za kinematografiju Vijeća Europe ( CoE ) Eurimages .
,"Obraćajući se okupljenima , premijer Sali Berisha kazao je kandidatima kako će , kada budu izabrani ,",dobiti,True,snažnu potporu vlada za svoje projekte .
,Svaka obitelj može,dobiti,True,do 500 eura pomoći .
,"Investicija nove poslovne zgrade vrijedna je 13 milijuna kuna , a zgrada sadrži oko 1000 četvornih metara poslovnog prostora raspoređenih na jednu podzemnu i tri nadzemne etaže , a osim prijemnih i administrativnih ureda te dvorana za sastanke , podzemna etaža opremljena je za procjenu šteta na vozilima , čime će osiguranici i poslovni partneri",dobiti,True,"još kvalitetniju , bržu i suvremeniju ponudu osiguravateljnih proizvoda na jednom mjestu ."
,Nakon stotinjak milijuna kuna,dobiti,True,u 2008. godini mirovinska su društva ( drugi stup ) zajedno iskazala nešto više od 140 milijuna kuna dobiti .
,Posao će,dobiti,True,"izravnom pogodbom , ali bez klasičnog nadmetanja kako je objasnio Vinko Filipović , ravnatelj Agencije za odgoj i obrazovanje , institucije nadležne za nabavu i distribuciju školskih naslova ."
,Ministar unutarnjih poslova Ranko Ostojić pojasnio je kako bi se takvi skupovi mogli,održavati,True,"između osam i 22 sata , a morali bi se najaviti pet dana ili u iznimnim situacijama 48 sati prije održavanja skupa ."
,"Veoma dobra , i kvalitetnija od LP je EL koja će sa vremenom",dobivati,True,sve veći značaj pogotovo za osrednje klubove i klubove koji nisu iz Liga petica .
,""" Volim",dobivati,True,"plaću na stari način , od blagajnika naše kompanije ."
,"Ako je pak mačka neprekidno pokazuje , trebalo bi je",odvesti,True,kod veterinara .
,Poduzetnici sredstva neće,dobivati,True,"nakon odobrenja projekta , nego će ga morati prvo sami financirati , a novac će im biti isplaćen nakon izvršenja ."
,Setimes : Očekujete li da će Makedonija,dobiti,True,poziv na samitu u Bukureštu i kako će to utjecati na sigurnosnu situaciju u regiji ?
,"Dodao je , međutim , kako svaka mirovna misija EU-a treba",dobiti,True,"odobrenje UN-ovog Vijeća sigurnosti , u kojem Rusija ima moć veta ."
,""" Ako rezultati izbora 1. listopada pokažu da je mađarski narod odbio paket , premijer mora odstupiti i sa sobom",odnijeti,True,"paket reformi "" , izjavio je Orban na tiskovnoj konferenciji u utorak , a prenosi tiskovna agencija Bloomberg ."
,"U iduća tri tjedna kandidati će obilaziti Hrvatsku ,",održavati,True,skupove i pozivati birače na sudjelovanje na izborima .
,Za pet godina moći će,dobiti,True,hrvatsko državljanstvo .
,"Također će biti iznesena preporuka treba li Bugarska ući u EU 1. siječnja 2007. godine , ili treba",odgoditi,True,njezin prijam na godinu dana u skladu sa zaštitnom klauzulom .
,SETimes : Kako bi se međunarodna zajednica i Kosovo trebali,odnositi,True,prema tom najnovijem događaju ?
,"Kako će , po vašem mišljenju , EU i Kosovo odgovoriti na te pozive i kako bi se sve strane trebale",odnositi,True,prema budućem dijalogu ?
,Kažu da neki vlasnici i zaposlenici mogu iskoristiti određene rupe u zakonu dok drugi ne,dobivaju,False,gotovo ništa .
,Većina proizvodnih tvrtki više ne postoji ili se,koriste,False,"za skladištenje robe ; učinkovitost kao koncept , čini se , bile su samo riječi , a nezaposlenost se produbljuje ."
,"Prendergast je istaknuo kako je od tada došlo do pozitivnih trendova , uključujući "" srdačne kontakte "" koje su održavali političari ciparskih Grka i ciparskih Turaka u",pokušaju,False,unaprjeđenja uzajamnog razumijevanja .
,Iako sve strane,govore,False,"kako žele rješenje , nedostaju preduvjeti za postizanje dogovora , kazao je ."
,"Annan je ukazao kako se ,",imajući,False,"u vidu situaciju , kani kretati "" vrlo oprezno "" u potrazi za rješenjem ."
,""" Podignuli smo svoj glas",tražeći,False,"poboljšanje socijalne i gospodarske situacije romskih građana , njihova obrazovanja , zdravstva , infrastrukture , smještaja , zapošljavanja , što je postalo dio nacionalne strategije za poboljšanje uvjeta života za Rome "" , rekao je Veliu ."
,"U međuvremenu ,",govoreći,False,"na skupu Zajedno za budućnost , Rama je istaknuo kako je konačno napravljen ljevičarski savez -- sa Socijalističkom strankom i Socijaldemokratskom strankom u njegovu jezgru ."
,IDC je objavio i rezultate za cjelokupno svjetsko tržište gdje je HP i dalje,vodeći,False,"s udjelom od 17,7 % ."
,Feronikel je privatiziran prije pet godina,i,False,"još uvijek posluje , ali u ozračju zabrinutosti za sigurnost radnika ."
,"Ali na Kosovu , kritičari kažu",da,False,"je pravni proces koji se odnosi na privatizaciju složen i politički naelektriziran , što ima dugoročan utjecaj na gospodarstvo ."
,Kažu,da,False,neki vlasnici i zaposlenici mogu iskoristiti određene rupe u zakonu dok drugi ne dobivaju gotovo ništa .
,A postoji,i,False,"etnička komponenta , s obzirom da pojedinci iz različitih zajednica mogu reći da diskriminacija -- bilo sada ili ranije -- utječe na mogućnost da izvuku korist iz privatizacije ."
,"Više od 600 milijuna eura prebačenih u banke u inozemstvu , a koje kosovska vlada ne koristi ,",donijela,False,je privatizacija javnih i državnih tvrtki posljednjih godina .
,""" Ništa pozitivno ne bi donijeli novi pokušaji koji bi se završili , kao što su se",završila,False,"prethodna dva , velikim neuspjehom ili frustrirajućim zastojem "" ."
,"Skupine grčkih navijača navodno su zlostavljane na putu do stadiona , a situacija je na samom stadionu",bila,False,kaotična .
,"Za razliku od toga , trojica su od najboljih igrača Grčke",morala,False,biti zamijenjena uslijed ozljeda koje su zadobili tijekom utakmice .
,"A postoji i etnička komponenta , s obzirom da pojedinci iz različitih zajednica mogu reći da diskriminacija -- bilo sada",ili,False,ranije -- utječe na mogućnost da izvuku korist iz privatizacije .
,Većina proizvodnih tvrtki više ne postoji,ili,False,"se koriste za skladištenje robe ; učinkovitost kao koncept , čini se , bile su samo riječi , a nezaposlenost se produbljuje ."
,"Sejdiu kaže da je to premalo , te da su neke zemlje u regiji prodavale samo jednu",ili,False,nekoliko tvrtki po toj cijeni .
,""" Ništa pozitivno ne bi",donijeli,False,"novi pokušaji koji bi se završili , kao što su se završila prethodna dva , velikim neuspjehom ili frustrirajućim zastojem "" ."
,Kažu da neki vlasnici i zaposlenici mogu iskoristiti određene rupe u zakonu dok drugi,ne,False,dobivaju gotovo ništa .
,""" Moj je otac radio u tvrtki Hidroteknika , [ kao i ja ] do prosinca 1990. godine , ali onda",sam,False,izgubio posao zato što su nas srpske vlasti otpustile .
,Nadao,sam,False,"se da ću nakon rata dobiti natrag svoj posao , ali to se nije dogodilo . """
,"Nakon što je Hidroteknika privatizirana 2006. godine , "" nisam dobio nikakvu naknadu , a najgore je to što tvrtka više",ne,False,"postoji , s obzirom da je novi vlasnik promijenio njezinu namjenu "" , rekao je Berisha za SETimes ."
,""" Moj je otac",radio,False,"u tvrtki Hidroteknika , [ kao i ja ] do prosinca 1990. godine , ali onda sam izgubio posao zato što su nas srpske vlasti otpustile ."
,"Nakon što je Hidroteknika privatizirana 2006. godine , "" nisam",dobio,False,"nikakvu naknadu , a najgore je to što tvrtka više ne postoji , s obzirom da je novi vlasnik promijenio njezinu namjenu "" , rekao je Berisha za SETimes ."
,Na koncu je i broj stranih ulagača,bio,False,"samo simboličan , kao i iznos koji su uložili "" , rekao je Sejdiu za SETimes ."
,"Sejdiu kaže kako je , iz ove perspektive , proces """,bio,False,"prenagljen ... bez plana za gospodarski razvoj "" , te da je privatizacija dovela do velikih problema za radnike ."
,"Sejdiu kaže da je to premalo ,",te,False,da su neke zemlje u regiji prodavale samo jednu ili nekoliko tvrtki po toj cijeni .
,"Sejdiu kaže kako je , iz ove perspektive , proces "" bio prenagljen ... bez plana za gospodarski razvoj "" ,",te,False,da je privatizacija dovela do velikih problema za radnike .
,"Unatoč svemu , osiguranje je bilo iznimno solidno ,",te,False,se nitko od navijača ili novinara nije uspio probiti do igrača u hotelu .
,"Natjecanje se održava petu godinu ,",te,False,"obuhvaća literaturu , prevođenje , glazbu , slikarstvo i kinematografiju ."
,Nadao sam se da ću nakon rata,dobiti,False,"natrag svoj posao , ali to se nije dogodilo . """
x,"Tu su i troškovi izgubljenih mogućnosti : "" U nekim slučajevima , privatizacija je mogla",donijeti,False,"bolje usluge i učinkovitost . """
x,"Iako je većina ciparskih Turaka poduprla predloženi sporazum , samo je međunarodno",priznati,False,dio mediteranskog otoka pod nadzorom ciparskih Grka na kraju ušao u EU 1. svibnja 2004. godine .
,""" Ljudi sa strane mogu",pomoći,False,", ali zainteresirane strane moraju prikupiti viziju , hrabrost i političku volju potrebnu za postizanje sporazuma , sa svim elementima koje podrazumijeva kompromis "" , kazao je Prendergast ."
,"Feronikel je privatiziran prije pet godina i još uvijek posluje , ali u ozračju zabrinutosti",za,False,sigurnost radnika .
,"Nakon što je Hidroteknika privatizirana 2006. godine , "" nisam dobio nikakvu naknadu , a najgore je to što tvrtka više ne postoji , s obzirom da je novi vlasnik promijenio njezinu namjenu "" , rekao je Berisha",za,False,SETimes .
,"Osim toga , mnoge tvrtke koje su privatizirane promijenile su lokaciju poslovanja , i vrlo često se zaposleni , kao što je Berisha , brišu s isplatnih lista , što dovodi do čestih prosvjeda ispred Agencije",za,False,privatizaciju .
,Većina proizvodnih tvrtki više ne postoji ili se koriste,za,False,"skladištenje robe ; učinkovitost kao koncept , čini se , bile su samo riječi , a nezaposlenost se produbljuje ."
,"A postoji i etnička komponenta , s obzirom da pojedinci iz različitih zajednica mogu reći da diskriminacija -- bilo sada ili ranije -- utječe na mogućnost da izvuku",korist,False,iz privatizacije .
,"Na koncu je i broj stranih ulagača bio samo simboličan , kao i",iznos,False,"koji su uložili "" , rekao je Sejdiu za SETimes ."
,Kada su u,pitanju,False,"oni koji i dalje rade , [ ne postoji ] jamstvo za sigurnost na radu ."
,""" Ministarstvo unutarnjih poslova obvezatno je skrenuti pozornost na visok rizik kada su u",pitanju,False,imovina i ljudski životi .
,"Većina proizvodnih tvrtki više ne postoji ili se koriste za skladištenje robe ; učinkovitost kao koncept , čini se ,",bile,False,"su samo riječi , a nezaposlenost se produbljuje ."
,"Što se tiče same igre , Maradonine "" upozoravajuće "" izjave o mogućim grubim startovima na zvijezde njegove momčadi",pokazale,False,"su se neosnovanima , budući da nitko od argentinskih igrača nije zadobio niti najmanju ozljedu ."
,Katalizator su,bile,False,prijetnje ultranacionalističkih skupina koje su dovele do otkazivanja nedjeljne gay Parade ponosa u Beogradu .
,Basescu je podigao tužbu protiv novina koje su prve,objavile,False,"fotografije navodnog incidenta , kao i Dinua Patriciua , poslovnog čovjeka koji je ustvrdio kako je svjedočio događaju ."
,"A postoji i etnička komponenta , s obzirom da pojedinci iz različitih zajednica mogu reći da diskriminacija --",bilo,False,sada ili ranije -- utječe na mogućnost da izvuku korist iz privatizacije .
,"Nadao sam se da ću nakon rata dobiti natrag svoj posao , ali to se nije",dogodilo,False,". """
,"Ukazuje na tvrtke u istočnoj regiji Ana Morava , gdje je ranije",bilo,False,""" gotovo 17.000 radnika u poduzećima koja su sada privatizirana ."
,""" Preuranjeno pokretanje intenzivnog novog procesa ne bi",bilo,False,"preporučivo "" , kazao je podtajnik UN-a za politička pitanja Kieran Prendergast informirajući Vijeće sigurnosti o svojem posjetu Cipru , Grčkoj i Turskoj ranije ovog mjeseca ."
,Natječaj za odabir najboljeg projekta muzeja bit će,održan,False,"u rujnu , rekao je ministar ."
,"Zasad ,",osiguran,False,je samo putnički promet .
,""" Prvo smo prije dvije godine uzeli kredit kako bismo otišli na medeni mjesec , a zatim sam naslijedio ovaj",stan,False,u koji smo se onda uselili .
,Događanje je privuklo 35.000,posjetitelja,False,", uključujući i američku glumicu Meg Ryan ."
,"Snimka pokazuje predsjednika koji se naginje s pozornice s koje je držao govor u gradu Ploiesti tokom kampanje na lokalnim izborima prije pet godina , nastojeći čuti ženu koja je zatražila",pomoć,False,.
,Radovi finalista,bit,False,"će izloženi u londonskoj Galeriji Saatchi 23. lipnja , kojom će prilikom biti odlučeno o pobjedniku ."
,Natječaj za odabir najboljeg projekta muzeja,bit,False,"će održan u rujnu , rekao je ministar ."
,"Banja Luka , u Bosni i Hercegovini ,",bit,False,"će domaćin međunarodnog festivala kratkog filma "" Kratkofil "" od utorka , 16. lipnja , do subote ."
,"Reagirajući na s time povezane napade bivšeg komunističkog disidenta i pjesnika Mircee Dinescua , predsjednikova je supruga Maria Basescu , koja se do sada nije stavljala u prvi plan , objavila",otvoreno,False,pismo u kojem je porekla tvrdnje kako ju je njen suprug udario .
,Natjecanje se,održava,False,"petu godinu , te obuhvaća literaturu , prevođenje , glazbu , slikarstvo i kinematografiju ."
,"Radovi finalista bit će izloženi u londonskoj Galeriji Saatchi 23. lipnja , kojom će prilikom biti",odlučeno,False,o pobjedniku .
,""" Iako pravila takvog preraspoređivanja mogu biti javno iznesena u vrijeme registriranja , time se",povećava,False,"zabrinutost glede kompatibilnosti takvih zakonskih mjera s demokratskim načelima , budući da se smanjuje transparentnost za birače "" , navodi OESS / ODIHR ."
,"Sadašnji predsjednik Traian Basescu i socijaldemokrat Mircea Geoana ,",bivši,False,"ministar vanjskih poslova , u nedjelju će se suočiti u drugom krugu predsjedničkih izbora ."
,Tužitelji su također tvrdili kako je,bivši,False,"ministar i suutemeljitelj takozvanog Odbora za obranu Ramusha Haradinaja dozvolio Morinino putovanje , a Ministarstvo kulture snosilo je troškove ."
,""" Na temelju kandidata koje su predložile zemlje članice , pokušao sam sastaviti kolegij koji može proizvesti svježe ideje i novi zamah u svezi s najvećim izazovima s kojima se Europa danas sučeljava "" , kazao je",bivši,False,portugalski premijer na tiskovnoj konferenciji u Bruxellesu .
,"Rehna će zamijeniti Stefan Fuele , češki ministar za europske poslove i",bivši,False,veleposlanik u NATO-u .
,""" Moj je otac radio u tvrtki Hidroteknika , [ kao i ja ] do prosinca 1990. godine , ali onda sam izgubio",posao,False,zato što su nas srpske vlasti otpustile .
,Nadao sam se da ću nakon rata dobiti natrag svoj,posao,False,", ali to se nije dogodilo . """
x,"Iako je većina ciparskih Turaka poduprla predloženi sporazum , samo je međunarodno",priznati,False,dio mediteranskog otoka pod nadzorom ciparskih Grka na kraju ušao u EU 1. svibnja 2004. godine .
x,Zamjenik ministra pravosuđa Slobodan Homen izjavio je za B92 kako vlasti planiraju,zatražiti,False,"od najvišeg suda u Srbiji "" zabranu svih udruga koje upućuju prijetnje "" ."
,Kosovo ozbiljno analizira proces privatizacije,u,False,svjetlu učestalih pritužbi .
,"Feronikel je privatiziran prije pet godina i još uvijek posluje , ali",u,False,ozračju zabrinutosti za sigurnost radnika .
,Kažu da neki vlasnici i zaposlenici mogu iskoristiti određene rupe,u,False,zakonu dok drugi ne dobivaju gotovo ništa .
,""" Moj je otac radio",u,False,"tvrtki Hidroteknika , [ kao i ja ] do prosinca 1990. godine , ali onda sam izgubio posao zato što su nas srpske vlasti otpustile ."
,A,postoji,False,"i etnička komponenta , s obzirom da pojedinci iz različitih zajednica mogu reći da diskriminacija -- bilo sada ili ranije -- utječe na mogućnost da izvuku korist iz privatizacije ."
,"Nakon što je Hidroteknika privatizirana 2006. godine , "" nisam dobio nikakvu naknadu , a najgore je to što tvrtka više ne",postoji,False,", s obzirom da je novi vlasnik promijenio njezinu namjenu "" , rekao je Berisha za SETimes ."
,Većina proizvodnih tvrtki više ne,postoji,False,"ili se koriste za skladištenje robe ; učinkovitost kao koncept , čini se , bile su samo riječi , a nezaposlenost se produbljuje ."
,"Kada su u pitanju oni koji i dalje rade , [ ne",postoji,False,] jamstvo za sigurnost na radu .
,Feronikel,je,False,"privatiziran prije pet godina i još uvijek posluje , ali u ozračju zabrinutosti za sigurnost radnika ."
,"Vlada prodaje poduzeća , rješava",se,False,"opterećenja njihovog upravljanja , a novac od prodaje pomaže punjenju državnog proračuna ."
,"Ali na Kosovu , kritičari kažu da",je,False,"pravni proces koji se odnosi na privatizaciju složen i politički naelektriziran , što ima dugoročan utjecaj na gospodarstvo ."
,Esat Berisha,je,False,jedan takav primjer .
,"I zaista ,",pokušajte,False,pretražiti neku njuzgrupu preko ovog servisa i vidjet ćete do koje godine seže arhiva ...
,"Ovo je još jedna dobro poznata softverska tvrtka koja se fokusira na izradu programa za spašavanje podataka , pa ako niti jedan program koji iskušate ne uspije vratiti ono što tražite ,",pokušajte,False,s njihovim R-Studio alatom .
,"Zdravlje je sada dobro , ali",povećajte,False,imunitet .
,"Ako vam je neugodno pred partnerom ,",pokušajte,False,same .
,"Ali na Kosovu , kritičari kažu da je pravni proces koji se odnosi na privatizaciju složen i politički naelektriziran , što",ima,False,dugoročan utjecaj na gospodarstvo .
,Ferronikeli je flagrantan slučaj u kojemu nedostatak političke volje da se riješi,pitanje,False,"sigurnosti na radu ugrožava živote radnika "" , rekao je za SETimes ."
,"Unatoč svemu ,",osiguranje,False,"je bilo iznimno solidno , te se nitko od navijača ili novinara nije uspio probiti do igrača u hotelu ."
,Institut je izdao,priopćenje,False,u kojem se navodi kako su svoje zaključke dostavili predsjedništvu .
,Proces privatizacije,na,False,Kosovu pod povećalom
,Barem,na,False,"papiru , izgleda kao odlična ideja ."
,Ali,na,False,"Kosovu , kritičari kažu da je pravni proces koji se odnosi na privatizaciju složen i politički naelektriziran , što ima dugoročan utjecaj na gospodarstvo ."
,"A postoji i etnička komponenta , s obzirom da pojedinci iz različitih zajednica mogu reći da diskriminacija -- bilo sada ili ranije -- utječe",na,False,mogućnost da izvuku korist iz privatizacije .
,""" Međutim , Beograd bi se mogao",naći,False,u bezizlaznoj situaciji :
,"Ipak , momčad nije mogla sanirati štetu nanesenu porazom 0:2 od Republike Koreje u svojem prvom nastupu u",skupini,False,"-- to je kvalifikaciju u drugi krug učinilo herkulskim podvigom , unatoč činjenici da su u sljedećoj utakmici porazili Nigeriju ."
,"Poraz od Argentine označio je kraj jedne ere , budući da je trener Otto Rehhagel najavio svoj dugo",očekivani,False,"odlazak iz reprezentacije , koju je trenirao posljednjih devet godina ."
,Ako,započne,False,"teretni promet , carinska i fitosanitarna inspekcija poljoprivrednih proizvoda bit će obavljana u Volkovu , oko 10 kilometara od granice ."
,Misija EU na Kosovu kaže kako će se protokolom,potpisanim,False,sa srbijanskom policijom pomoći napori na jačanju vladavine zakona te kako on ne prijeti suverenitetu Kosova .
,U izjavama,danim,False,"za BBC , grčki stručnjak za terorizam Athanasios Drougas ukazao je na Revolucionarnu borbu , najnasilniju militantnu skupinu u zemlji , koja se nalazi na popisima terorističkih organizacija EU i SAD-a , kao moguće počinitelje bombaškog napada ."
,"Velčev , koji je preuzeo dužnost prije manje od mjesec dana , informirao je Rehna o",planiranim,False,"strukturnim promjenama u tužiteljstvu , obećavajući također kako će idućih dana biti podignute optužnice protiv ključnih šefova podzemlja ."
,"Razgovorima ,",održanim,False,"19. veljače u Sofiji , također je nazočio Sergej Kirijenko , ravnatelj Rosatoma , regulatornog tijela ruske nuklearne industrije ."
,"Mahlyanov , 22 , nedavno je pobijedio na prestižnom Emperor kupu na drugom velikom proljetnom turniru u "" sumo "" hrvanju",održanom,False,u Osaki .
,"Studentska sportska udruga ' Baltazar Adam Krčelić ' Zaprešić nastupila je na svom prvom službenom natjecanju , na 5. Studentskim sportskim susretima veleučilišta i visokih škola Republike Hrvatske Pula 2013. ,",održanom,False,od 7. do 9. lipnja 2013. u Puli .
,Hrvatska premijerka Jadranka Kosor i njen ruski kolega Vladimir Putin potvrdili su bilateralnu gospodarsku suradnju na sastanku,održanom,False,19. lipnja u Moskvi .
,Poznati makedonski redatelj Milčo Mančevski započeo je rad na svojem trećem,igranom,False,"filmu "" Kosti "" ."
,"Reagirajući na takvo stanje , Skender Veliu , koji je na čelu romskog saveza Amaro-Drom u Albaniji , izjavio je da su tamošnje manjine ustrojile",skupinu,False,"koja predstavlja Grke , Makedonce , Srbe , Crnogorce i Bosance te razgovaraju o svojim konkretnim problemima ."
,Obitelj Mrdak živi u,stanu,False,"u Beogradu , a većinu su svojih stvari kupili zahvaljujući bankovnim kreditima i zajmovima ."
,Turski model hoda pistom na prvom,danu,False,Tjedna mode u Istanbulu .
,"Terry Venables , bivši engleski reprezentativac , u svojoj kolumni za The Sun komentirao je svaku",skupinu,False,na Euru .
,"Ministar unutarnjih poslova Ranko Ostojić pojasnio je kako bi se takvi skupovi mogli održavati između osam i 22 sata , a morali bi se najaviti pet dana ili u iznimnim situacijama 48 sati prije",održavanja,False,skupa .
,"Zasad se zna da će HAMAG nastaviti raditi sa sličnim modelima po kojima je već poznat - jamstvima i potporama poduzetnicima , no otvorena je i mogućnost",davanja,False,"mikrokredita , ili osnivanja fondova rizičnog kapitala , što upravo provodi Slovenski fond ."
,"Naravno da postoje nijanse , ovisno o veličini ega te osobe , ali postoji samo jedan način da se to ispravno radi , a to je mješavina rukovođenja i",davanja,False,"prilike drugima da odigraju vlastitu ulogu "" ."
,"Na sastanku na kojem se razgovaralo o gospodarskoj suradnji između Kosova i Albanije , zamjenica predsjednika vlade Kosova Mimoza Kusari Lila i albanski premijer Sali Berisha odlučili su ukinuti carinska",davanja,False,koja ometaju kosovske izvoznike .
,Novi je muzej dio inicijative vlade usmjerene na poticanje turizma i,ostvarivanje,False,cilja od 30 milijuna stranih turista za 2010. i 2011 .
,Antonijević iz YUCOM-a potvrđuje da Srbija tek treba pronaći mehanizam za,priznavanje,False,sveučilišnih diploma s Kosova .
,"Međutim , koherentnost nedostaje u predstavljanju eurozone u međunarodnim financijskim institucijama - unatoč dogovoru Europskog vijeća iz Beča u prosincu 1998. da će se pozabaviti tim",pitanjem,False,.
,"Kroz povijest je razvoj i djelovanje franjevaca konventualaca ove Provincije bilo uvjetovano političkim , gospodarskim , kulturnim i socijalnim",stanjem,False,"koje je nametala Venecija , a krizna vremena osobito je donijela Mletačka republika koja je u 18. st. zatvarala mnoge samostane ."
,Podtajnik UN-a za politička,pitanja,False,Kieran Prendergast ( lijevo ) rukuje se s čelnikom ciparskih Turaka Mehmetom Ali Talatom tijekom posjeta podijeljenom otoku .
,""" Preuranjeno pokretanje intenzivnog novog procesa ne bi bilo preporučivo "" , kazao je podtajnik UN-a za politička",pitanja,False,"Kieran Prendergast informirajući Vijeće sigurnosti o svojem posjetu Cipru , Grčkoj i Turskoj ranije ovog mjeseca ."
,Također je obećao rješenje legalizacije i,pitanja,False,imovine .
,Maria Damanaki iz Grčke imenovana je za novu povjerenicu za pomorska,pitanja,False,"i ribolov , dok će povjerenica za zdravstvo u odlasku -- Androulla Vassiliou s Cipra -- biti na čelu povjerenstva za školstvo , kulturu , multijezičnost i mladež ."
,"Vlada prodaje poduzeća , rješava se opterećenja njihovog upravljanja ,",a,False,novac od prodaje pomaže punjenju državnog proračuna .
,"Nakon što je Hidroteknika privatizirana 2006. godine , "" nisam dobio nikakvu naknadu ,",a,False,"najgore je to što tvrtka više ne postoji , s obzirom da je novi vlasnik promijenio njezinu namjenu "" , rekao je Berisha za SETimes ."
,"Većina proizvodnih tvrtki više ne postoji ili se koriste za skladištenje robe ; učinkovitost kao koncept , čini se , bile su samo riječi ,",a,False,nezaposlenost se produbljuje .
,"Više od 600 milijuna eura prebačenih u banke u inozemstvu ,",a,False,"koje kosovska vlada ne koristi , donijela je privatizacija javnih i državnih tvrtki posljednjih godina ."
,Kosovo ozbiljno analizira proces privatizacije,u,False,svjetlu učestalih pritužbi .
,"Feronikel je privatiziran prije pet godina i još uvijek posluje , ali",u,False,ozračju zabrinutosti za sigurnost radnika .
,Kažu da neki vlasnici i zaposlenici mogu iskoristiti određene rupe,u,False,zakonu dok drugi ne dobivaju gotovo ništa .
,""" Moj je otac radio",u,False,"tvrtki Hidroteknika , [ kao i ja ] do prosinca 1990. godine , ali onda sam izgubio posao zato što su nas srpske vlasti otpustile ."
,Skupine grčkih navijača,navodno,False,"su zlostavljane na putu do stadiona , a situacija je na samom stadionu bila kaotična ."
,Prije,no,False,"što je branič Martin Demichelis u 76. minuti spremio odbijenu loptu u grčku mrežu , "" čudesnog "" Messija je uglavnom uspijevao zadržati mladi stoper iz kluba Genoa FC Sokratis Papastathopoulos , kojem bi solidni nastupi na Svjetskom kupu 2010. mogli otvoriti i vrata nekog još većeg kluba ."
,Film koji,navodno,False,prikazuje Basescua kako udara dijete na skupu 2004. potakao je kontroverze u zemlji .
