,Svečano ponovno pokretanje linije Skoplje - Priština,održano,False,"je u prosincu prošle godine , kada je skupina ministara makedonske vlade otputovala vlakom u Prištinu ."
,EULEX : Sporazumom će se pojačati borba protiv,organiziranog,False,kriminala
,"Mirovna misija EULEX-a potpisala je u petak ( 11. rujna ) protokol sa srbijanskim ministarstvom unutarnjih poslova , čime je utrt put suradnji u borbi protiv",organiziranog,False,kriminala i krijumčarenja .
,""" Cilj im je borba protiv",organiziranog,False,kriminala i krijumčarenja .
,"Ukazao je kako uvjeti za članstvo u EU uključuju poštivanje ljudskih i manjinskih prava , kao i napore u borbi protiv ilegalne imigracije ,",organiziranog,False,kriminala i korupcije .
,U Skoplju je u utorak ( 12. prosinac ),otvoren,False,4. Romski amaterski kazališni festival .
,Sedamnaesti summit šefova država i vlada zemalja članica NATO-a u Istanbulu,završen,False,je u utorak ( 29. lipanj ) .
,U izvješću se zemlji pripisuju zasluge za rad,ostvaren,False,"na području zakonodavstva , gospodarstva i provedbe Sporazuma o stabilizaciji i pridruživanju ."
,Dio HAMAG-ove pripreme je i natječaj za prijavu konzultanata osposobljenih za pisanje projekata koji je,otvoren,False,do 11. studenoga .
