 , Ïninque tömënäni pöninque mönö teiyë waëmö oncö wo ,ëwëmaïnänipa,True, 
x," Äñönäni Itota weetë tömënäni ïnänite , — Wengonguï teiyë waëmö oncö ince mïnitö ïincö be tate ",ëwëmïni,True," ïninque botö mëönaa go adoöneque ïñö mïincö mënonceboimpa , ämopa "
x, Incete mïnitö baö ince ocaguï ince adoguinque ince ëmëwo ,ëwënämaï,True, ingëimpa 
x, Ïñempa odömäno awënë beyë në ,ëwënäni,True, ince mïnitö waadete pönenganca adoganca cedinque tömënäni ïnänite në waadete pönënänique ïnänite waadete pönënänipa töö 
x, Odömäno awënë beyë në ,ëwëningä,True, Mäateo tönö Tömato mënaa ïnapa 
x," tömengä ingante wapiticë apënedinque , — Bitö ïñempa Wengonguï teiyë waëmö oncö ince be tate wo ",ëwëninque,True, ede mëönaa go adoöneque ïñonte do mënonce ämitawo 
x, Weetë ede baö tönö önöwoca tadömengadenguipo në ömëe ,ëwënongä,True, ingante guiquënë mïnitö tömengä ingante guïñente weedäni 
